3Dc,"3Dc (FourCC : ATI2), also known as DXN, BC5, or Block Compression 5 is a lossy data compression algorithm for normal maps invented and first implemented by ATI. It builds upon the earlier DXT5 algorithm and is an open standard. 3Dc is now implemented by both ATI and Nvidia."
A*,"In computer science, A* (pronounced as ""A star"" ( listen)) is a computer algorithm that is widely used in pathfinding and graph traversal, the process of plotting an efficiently traversable path between multiple points, called nodes. Noted for its performance and accuracy, it enjoys widespread use. However, in practical travel-routing systems, it is generally outperformed by algorithms which can pre-process the graph to attain better performance, although other work has found A* to be superior to other approaches.
Peter Hart, Nils Nilsson and Bertram Raphael of Stanford Research Institute (now SRI International) first described the algorithm in 1968. It is an extension of Edsger Dijkstra's 1959 algorithm. A* achieves better performance by using heuristics to guide its search."
ALOPEX,"ALOPEX (an acronym from ""ALgorithms Of Pattern EXtraction"") is a correlation based machine learning algorithm first proposed by Tzanakou and Harth in 1974."
AdaBoost,"AdaBoost, short for ""Adaptive Boosting"", is a machine learning meta-algorithm formulated by Yoav Freund and Robert Schapire who won the Gödel Prize in 2003 for their work. It can be used in conjunction with many other types of learning algorithms to improve their performance. The output of the other learning algorithms ('weak learners') is combined into a weighted sum that represents the final output of the boosted classifier. AdaBoost is adaptive in the sense that subsequent weak learners are tweaked in favor of those instances misclassified by previous classifiers. AdaBoost is sensitive to noisy data and outliers. In some problems, however, it can be less susceptible to the overfitting problem than other learning algorithms. The individual learners can be weak, but as long as the performance of each one is slightly better than random guessing (i.e., their error rate is smaller than 0.5 for binary classification), the final model can be proven to converge to a strong learner
While every learning algorithm will tend to suit some problem types better than others, and will typically have many different parameters and configurations to be adjusted before achieving optimal performance on a dataset, AdaBoost (with decision trees as the weak learners) is often referred to as the best out-of-the-box classifier. When used with decision tree learning, information gathered at each stage of the AdaBoost algorithm about the relative 'hardness' of each training sample is fed into the tree growing algorithm such that later trees tend to focus on harder to classify examples."
Adaptive coding,"Adaptive coding refers to variants of entropy encoding methods of lossless data compression. They are particularly suited to streaming data, as they adapt to localized changes in the characteristics of the data, and don't require a first pass over the data to calculate a probability model. The cost paid for these advantages is that the encoder and decoder must be more complex to keep their states synchronized, and more computational power is needed to keep adapting the encoder/decoder state.
Almost all data compression methods involve the use of a model, a prediction of the composition of the data. When the data matches the prediction made by the model, the encoder can usually transmit the content of the data at a lower information cost, by making reference to the model. This general statement is a bit misleading as general data compression algorithm would include the popular LZW and LZ77 algorithms, which are hardly comparable to compression techniques typically called adaptive. Run length encoding and the typical JPEG compression with run length encoding and predefined Huffman codes do not transmit a model. A lot of other methods adapt their model to the current file and need to transmit it in addition to the encoded data, because both the encoder and the decoder need to use the model.
In adaptive coding, the encoder and decoder are instead equipped with a predefined meta-model about how they will alter their models in response to the actual content of the data, and otherwise start with a blank slate, meaning that no initial model needs to be transmitted. As the data is transmitted, both encoder and decoder adapt their models, so that unless the character of the data changes radically, the model becomes better-adapted to the data its handling and compresses it more efficiently approaching the efficiency of the static coding.

"
Adaptive replacement cache,"Adaptive Replacement Cache (ARC) is a page replacement algorithm with better performance than LRU (Least Recently Used) developed at the IBM Almaden Research Center. This is accomplished by keeping track of both Frequently Used and Recently Used pages plus a recent eviction history for both. In 2006, IBM was granted a patent for the adaptive replacement cache policy.

"
Addition-chain exponentiation,"In mathematics and computer science, optimal addition-chain exponentiation is a method of exponentiation by positive integer powers that requires a minimal number of multiplications. It works by creating the shortest addition chain that generates the desired exponent. Each exponentiation in the chain can be evaluated by multiplying two of the earlier exponentiation results. More generally, addition-chain exponentiation may also refer to exponentiation by non-minimal addition chains constructed by a variety of algorithms (since a shortest addition chain is very difficult to find).
The shortest addition-chain algorithm requires no more multiplications than binary exponentiation and usually less. The first example of where it does better is for a15, where the binary method needs six multiplications but a shortest addition chain requires only five:
 (binary, 6 multiplications)
 (shortest addition chain, 5 multiplications).
On the other hand, the determination of a shortest addition chain is hard: no efficient optimal methods are currently known for arbitrary exponents, and the related problem of finding a shortest addition chain for a given set of exponents has been proven NP-complete. Even given a shortest chain, addition-chain exponentiation requires more memory than the binary method, because it must potentially store many previous exponents from the chain. So in practice, shortest addition-chain exponentiation is primarily used for small fixed exponents for which a shortest chain can be precomputed and is not too large.
There are also several methods to approximate a shortest addition chain, and which often require fewer multiplications than binary exponentiation; binary exponentiation itself is a suboptimal addition-chain algorithm. The optimal algorithm choice depends on the context (such as the relative cost of the multiplication and the number of times a given exponent is re-used).
The problem of finding the shortest addition chain cannot be solved by dynamic programming, because it does not satisfy the assumption of optimal substructure. That is, it is not sufficient to decompose the power into smaller powers, each of which is computed minimally, since the addition chains for the smaller powers may be related (to share computations). For example, in the shortest addition chain for a15 above, the subproblem for a6 must be computed as (a3)2 since a3 is re-used (as opposed to, say, a6 = a2(a2)2, which also requires three multiplies)."
Adler-32,"Adler-32 is a checksum algorithm which was invented by Mark Adler in 1995, and is a modification of the Fletcher checksum. Compared to a cyclic redundancy check of the same length, it trades reliability for speed (preferring the latter). Adler-32 is more reliable than Fletcher-16, and slightly less reliable than Fletcher-32."
Aho–Corasick string matching algorithm,"In computer science, the Aho–Corasick algorithm is a string searching algorithm invented by Alfred V. Aho and Margaret J. Corasick. It is a kind of dictionary-matching algorithm that locates elements of a finite set of strings (the ""dictionary"") within an input text. It matches all patterns simultaneously. The complexity of the algorithm is linear in the length of the patterns plus the length of the searched text plus the number of output matches. Note that because all matches are found, there can be a quadratic number of matches if every substring matches (e.g. dictionary = a, aa, aaa, aaaa and input string is aaaa).
Informally, the algorithm constructs a finite state machine that resembles a trie with additional links between the various internal nodes. These extra internal links allow fast transitions between failed pattern matches (e.g. a search for cat in a trie that does not contain cat, but contains cart, and thus would fail at the node prefixed by ca), to other branches of the trie that share a common prefix (e.g., in the previous case, a branch for attribute might be the best lateral transition). This allows the automaton to transition between pattern matches without the need for backtracking.
When the pattern dictionary is known in advance (e.g. a computer virus database), the construction of the automaton can be performed once off-line and the compiled automaton stored for later use. In this case, its run time is linear in the length of the input plus the number of matched entries.
The Aho–Corasick string matching algorithm formed the basis of the original Unix command fgrep."
Algorithm X,"""Algorithm X"" is the name Donald Knuth used in his paper ""Dancing Links"" to refer to ""the most obvious trial-and-error approach"" for finding all solutions to the exact cover problem. Technically, Algorithm X is a recursive, nondeterministic, depth-first, backtracking algorithm. While Algorithm X is generally useful as a succinct explanation of how the exact cover problem may be solved, Knuth's intent in presenting it was merely to demonstrate the utility of the dancing links technique via an efficient implementation he called DLX.
The exact cover problem is represented in Algorithm X using a matrix A consisting of 0s and 1s. The goal is to select a subset of the rows so that the digit 1 appears in each column exactly once.
Algorithm X functions as follows:

The nondeterministic choice of r means that the algorithm essentially clones itself into independent subalgorithms; each subalgorithm inherits the current matrix A, but reduces it with respect to a different row r. If column c is entirely zero, there are no subalgorithms and the process terminates unsuccessfully.
The subalgorithms form a search tree in a natural way, with the original problem at the root and with level k containing each subalgorithm that corresponds to k chosen rows. Backtracking is the process of traversing the tree in preorder, depth first.
Any systematic rule for choosing column c in this procedure will find all solutions, but some rules work much better than others. To reduce the number of iterations, Knuth suggests that the column choosing algorithm select a column with the lowest number of 1s in it."
Algorithms for Recovery and Isolation Exploiting Semantics,"In computer science, Algorithms for Recovery and Isolation Exploiting Semantics, or ARIES is a recovery algorithm designed to work with a no-force, steal database approach; it is used by IBM DB2, Microsoft SQL Server and many other database systems.
Three main principles lie behind ARIES
Write ahead logging: Any change to an object is first recorded in the log, and the log must be written to stable storage before changes to the object are written to disk.
Repeating history during Redo: On restart after a crash, ARIES retraces the actions of a database before the crash and brings the system back to the exact state that it was in before the crash. Then it undoes the transactions still active at crash time.
Logging changes during Undo: Changes made to the database while undoing transactions are logged to ensure such an action isn't repeated in the event of repeated restarts."
Algorithms for calculating variance,"Algorithms for calculating variance play a major role in computational statistics. A key problem in the design of good algorithms for this problem is that formulas for the variance may involve sums of squares, which can lead to numerical instability as well as to arithmetic overflow when dealing with large values."
Alpha-beta pruning,"Alpha–beta pruning is a search algorithm that seeks to decrease the number of nodes that are evaluated by the minimax algorithm in its search tree. It is an adversarial search algorithm used commonly for machine playing of two-player games (Tic-tac-toe, Chess, Go, etc.). It stops completely evaluating a move when at least one possibility has been found that proves the move to be worse than a previously examined move. Such moves need not be evaluated further. When applied to a standard minimax tree, it returns the same move as minimax would, but prunes away branches that cannot possibly influence the final decision."
Alpha max plus beta min algorithm,"The alpha max plus beta min algorithm is a high-speed approximation of the square root of the sum of two squares. The square root of the sum of two squares, also known as Pythagorean addition, is a useful function, because it finds the hypotenuse of a right triangle given the two side lengths, the norm of a 2-D vector, or the magnitude of a complex number z=a+bi given the real and imaginary parts.

The algorithm avoids performing the square and square-root operations, instead using simple operations such as comparison, multiplication, and addition. Some choices of the α and β parameters of the algorithm allow the multiplication operation to be reduced to a simple shift of binary digits that is particularly well suited to implementation in high-speed digital circuitry.
The approximation is expressed as:

Where  is the maximum absolute value of a and b and  is the minimum absolute value of a and b.
For the closest approximation, the optimum values for  and  are  and , giving a maximum error of 3.96%."
Approximate counting algorithm,"The approximate counting algorithm allows the counting of a large number of events using a small amount of memory. Invented in 1977 by Robert Morris (cryptographer) of Bell Labs, it uses probabilistic techniques to increment the counter. It was fully analyzed in the early 1980s by Philippe Flajolet of INRIA Rocquencourt, who coined the name Approximate Counting, and strongly contributed to its recognition among the research community. The algorithm is considered one of the precursors of streaming algorithms, and the more general problem of determining the frequency moments of a data stream has been central to the field."
Apriori algorithm,Apriori is an algorithm for frequent item set mining and association rule learning over transactional databases. It proceeds by identifying the frequent individual items in the database and extending them to larger and larger item sets as long as those item sets appear sufficiently often in the database. The frequent item sets determined by Apriori can be used to determine association rules which highlight general trends in the database: this has applications in domains such as market basket analysis.
Astronomical algorithms,"Astronomical algorithms are the algorithms used to calculate ephemerides, calendars, and positions (as in celestial navigation or satellite navigation). Examples of large and complex astronomical algorithms are those used to calculate the position of the Moon. A simple example is the calculation of the Julian day.
Numerical model of solar system discusses a generalized approach to local astronomical modeling. The variations séculaires des orbites planétaires describes an often used model.

"
B*,"In computer science, B* (pronounced ""B star"") is a best-first graph search algorithm that finds the least-cost path from a given initial node to any goal node (out of one or more possible goals). First published by Hans Berliner in 1979, it is related to the A* search algorithm."
BFGS method,"In numerical optimization, the Broyden–Fletcher–Goldfarb–Shanno (BFGS) algorithm is an iterative method for solving unconstrained nonlinear optimization problems.
The BFGS method approximates Newton's method, a class of hill-climbing optimization techniques that seeks a stationary point of a (preferably twice continuously differentiable) function. For such problems, a necessary condition for optimality is that the gradient be zero. Newton's method and the BFGS methods are not guaranteed to converge unless the function has a quadratic Taylor expansion near an optimum. These methods use both the first and second derivatives of the function. However, BFGS has proven to have good performance even for non-smooth optimizations.
In quasi-Newton methods, the Hessian matrix of second derivatives doesn't need to be evaluated directly. Instead, the Hessian matrix is approximated using rank-one updates specified by gradient evaluations (or approximate gradient evaluations). Quasi-Newton methods are generalizations of the secant method to find the root of the first derivative for multidimensional problems. In multi-dimensional problems, the secant equation does not specify a unique solution, and quasi-Newton methods differ in how they constrain the solution. The BFGS method is one of the most popular members of this class. Also in common use is L-BFGS, which is a limited-memory version of BFGS that is particularly suited to problems with very large numbers of variables (e.g., >1000). The BFGS-B variant handles simple box constraints."
Baby-step giant-step,"In group theory, a branch of mathematics, the baby-step giant-step is a meet-in-the-middle algorithm computing the discrete logarithm. The discrete log problem is of fundamental importance to the area of public key cryptography. Many of the most commonly used cryptography systems are based on the assumption that the discrete log is extremely difficult to compute; the more difficult it is, the more security it provides a data transfer. One way to increase the difficulty of the discrete log problem is to base the cryptosystem on a larger group."
Backtracking,"Backtracking is a general algorithm for finding all (or some) solutions to some computational problems, notably constraint satisfaction problems, that incrementally builds candidates to the solutions, and abandons each partial candidate c (""backtracks"") as soon as it determines that c cannot possibly be completed to a valid solution.
The classic textbook example of the use of backtracking is the eight queens puzzle, that asks for all arrangements of eight chess queens on a standard chessboard so that no queen attacks any other. In the common backtracking approach, the partial candidates are arrangements of k queens in the first k rows of the board, all in different rows and columns. Any partial solution that contains two mutually attacking queens can be abandoned.
Backtracking can be applied only for problems which admit the concept of a ""partial candidate solution"" and a relatively quick test of whether it can possibly be completed to a valid solution. It is useless, for example, for locating a given value in an unordered table. When it is applicable, however, backtracking is often much faster than brute force enumeration of all complete candidates, since it can eliminate a large number of candidates with a single test.
Backtracking is an important tool for solving constraint satisfaction problems, such as crosswords, verbal arithmetic, Sudoku, and many other puzzles. It is often the most convenient (if not the most efficient) technique for parsing, for the knapsack problem and other combinatorial optimization problems. It is also the basis of the so-called logic programming languages such as Icon, Planner and Prolog.
Backtracking depends on user-given ""black box procedures"" that define the problem to be solved, the nature of the partial candidates, and how they are extended into complete candidates. It is therefore a metaheuristic rather than a specific algorithm – although, unlike many other meta-heuristics, it is guaranteed to find all solutions to a finite problem in a bounded amount of time.
The term ""backtrack"" was coined by American mathematician D. H. Lehmer in the 1950s. The pioneer string-processing language SNOBOL (1962) may have been the first to provide a built-in general backtracking facility."
Bailey–Borwein–Plouffe formula,"The Bailey–Borwein–Plouffe formula (BBP formula) is a spigot algorithm for computing the nth binary digit of pi (symbol: π) using base 16 math. The formula can directly calculate the value of any given digit of π without calculating the preceding digits. The BBP is a summation-style formula that was discovered in 1995 by Simon Plouffe and was named after the authors of the paper in which the formula was published, David H. Bailey, Peter Borwein, and Simon Plouffe. Before that paper, it had been published by Plouffe on his own site. The formula is
.
The discovery of this formula came as a surprise. For centuries it had been assumed that there was no way to compute the nth digit of π without calculating all of the preceding n − 1 digits.
Since this discovery, many formulas for other irrational constants have been discovered of the general form

where α is the constant and p and q are polynomials in integer coefficients and b ≥ 2 is an integer base.
Formulas in this form are known as BBP-type formulas. Certain combinations of specific p, q and b result in well-known constants, but there is no systematic algorithm for finding the appropriate combinations; known formulas are discovered through experimental mathematics."
Banker's algorithm,"The Banker's algorithm, sometimes referred to as the avoidance algorithm, is a resource allocation and deadlock avoidance algorithm developed by Edsger Dijkstra that tests for safety by simulating the allocation of predetermined maximum possible amounts of all resources, and then makes an ""s-state"" check to test for possible deadlock conditions for all other pending activities, before deciding whether allocation should be allowed to continue.
The algorithm was developed in the design process for the THE operating system and originally described (in Dutch) in EWD108. When a new process enters a system, it must declare the maximum number of instances of each resource type that it may ever claim; clearly, that number may not exceed the total number of resources in the system. Also, when a process gets all its requested resources it must return them in a finite amount of time."
Basic Local Alignment Search Tool,"In bioinformatics, BLAST for Basic Local Alignment Search Tool is an algorithm for comparing primary biological sequence information, such as the amino-acid sequences of different proteins or the nucleotides of DNA sequences. A BLAST search enables a researcher to compare a query sequence with a library or database of sequences, and identify library sequences that resemble the query sequence above a certain threshold.
Different types of BLASTs are available according to the query sequences. For example, following the discovery of a previously unknown gene in the mouse, a scientist will typically perform a BLAST search of the human genome to see if humans carry a similar gene; BLAST will identify sequences in the human genome that resemble the mouse gene based on similarity of sequence. The BLAST algorithm and program were designed by Stephen Altschul, Warren Gish, Webb Miller, Eugene Myers, and David J. Lipman at the National Institutes of Health and was published in the Journal of Molecular Biology in 1990 and cited over 50,000 times."
Baum–Welch algorithm,"In electrical engineering, computer science, statistical computing and bioinformatics, the Baum–Welch algorithm is used to find the unknown parameters of a hidden Markov model (HMM). It makes use of the forward-backward algorithm and is named for Leonard E. Baum and Lloyd R. Welch."
Bead sort,"Bead sort is a natural sorting algorithm, developed by Joshua J. Arulanandham, Cristian S. Calude and Michael J. Dinneen in 2002, and published in The Bulletin of the European Association for Theoretical Computer Science. Both digital and analog hardware implementations of bead sort can achieve a sorting time of O(n); however, the implementation of this algorithm tends to be significantly slower in software and can only be used to sort lists of positive integers. Also, it would seem that even in the best case, the algorithm requires O(n2) space.

"
