Lempel–Ziv–Markov chain algorithm,"The Lempel–Ziv–Markov chain algorithm (LZMA) is an algorithm used to perform lossless data compression. It has been under development either since 1998 or 1996 and was first used in the 7z format of the 7-Zip archiver. This algorithm uses a dictionary compression scheme somewhat similar to the LZ77 algorithm published by Abraham Lempel and Jacob Ziv in 1977 and features a high compression ratio (generally higher than bzip2)) and a variable compression-dictionary size (up to 4 GB), while still maintaining decompression speed similar to other commonly used compression algorithms.
LZMA2 is a simple container format that can include both uncompressed data and LZMA data, possibly with multiple different LZMA encoding parameters. LZMA2 supports arbitrarily scalable multithreaded compression and decompression and efficient compression of data which is partially incompressible."
Lempel–Ziv–Oberhumer,"Lempel–Ziv–Oberhumer (LZO) is a lossless data compression algorithm that is focused on decompression speed.

"
Lempel–Ziv–Stac,"Lempel–Ziv–Stac (LZS, or Stac compression) is a lossless data compression algorithm that uses a combination of the LZ77 sliding-window compression algorithm and fixed Huffman coding. It was originally developed by Stac Electronics for tape compression, and subsequently adapted for hard disk compression and sold as the Stacker disk compression software. It was later specified as a compression algorithm for various network protocols. LZS is specified in the Cisco IOS stack."
Lempel–Ziv–Storer–Szymanski,"Lempel–Ziv–Storer–Szymanski (LZSS) is a lossless data compression algorithm, a derivative of LZ77, that was created in 1982 by James Storer and Thomas Szymanski. LZSS was described in article ""Data compression via textual substitution"" published in Journal of the ACM (pp. 928–951).
LZSS is a dictionary encoding technique. It attempts to replace a string of symbols with a reference to a dictionary location of the same string.
The main difference between LZ77 and LZSS is that in LZ77 the dictionary reference could actually be longer than the string it was replacing. In LZSS, such references are omitted if the length is less than the ""break even"" point. Furthermore, LZSS uses one-bit flags to indicate whether the next chunk of data is a literal (byte) or a reference to an offset/length pair."
Lempel–Ziv–Welch,"Lempel–Ziv–Welch (LZW) is a universal lossless data compression algorithm created by Abraham Lempel, Jacob Ziv, and Terry Welch. It was published by Welch in 1984 as an improved implementation of the LZ78 algorithm published by Lempel and Ziv in 1978. The algorithm is simple to implement, and has the potential for very high throughput in hardware implementations. It was the algorithm of the widely used Unix file compression utility compress, and is used in the GIF image format."
Lenstra elliptic curve factorization,"The Lenstra elliptic curve factorization or the elliptic curve factorization method (ECM) is a fast, sub-exponential running time algorithm for integer factorization which employs elliptic curves. For general purpose factoring, ECM is the third-fastest known factoring method. The second fastest is the multiple polynomial quadratic sieve and the fastest is the general number field sieve. The Lenstra elliptic curve factorization is named after Hendrik Lenstra.
Practically speaking, ECM is considered a special purpose factoring algorithm as it is most suitable for finding small factors. Currently, it is still the best algorithm for divisors not greatly exceeding 20 to 25 digits (64 to 83 bits or so), as its running time is dominated by the size of the smallest factor p rather than by the size of the number n to be factored. Frequently, ECM is used to remove small factors from a very large integer with many factors; if the remaining integer is still composite, then it has only large factors and is factored using general purpose techniques. The largest factor found using ECM so far has 83 digits and was discovered on 7 September 2013 by R. Propper. Increasing the number of curves tested improves the chances of finding a factor, but they are not linear with the increase in the number of digits."
Level set method,"Level set methods (LSM) are a conceptual framework for using level sets as a tool for numerical analysis of surfaces and shapes. The advantage of the level set model is that one can perform numerical computations involving curves and surfaces on a fixed Cartesian grid without having to parameterize these objects (this is called the Eulerian approach). Also, the level set method makes it very easy to follow shapes that change topology, for example when a shape splits in two, develops holes, or the reverse of these operations. All these make the level set method a great tool for modeling time-varying objects, like inflation of an airbag, or a drop of oil floating in water.

The figure on the right illustrates several important ideas about the level set method. In the upper-left corner we see a shape; that is, a bounded region with a well-behaved boundary. Below it, the red surface is the graph of a level set function  determining this shape, and the flat blue region represents the xy-plane. The boundary of the shape is then the zero level set of , while the shape itself is the set of points in the plane for which  is positive (interior of the shape) or zero (at the boundary).
In the top row we see the shape changing its topology by splitting in two. It would be quite hard to describe this transformation numerically by parameterizing the boundary of the shape and following its evolution. One would need an algorithm able to detect the moment the shape splits in two, and then construct parameterizations for the two newly obtained curves. On the other hand, if we look at the bottom row, we see that the level set function merely translated downward. This is an example of when it can be much easier to work with a shape through its level set function than with the shape directly, where using the shape directly would need to consider and handle all the possible deformations the shape might undergo.
Thus, in two dimensions, the level set method amounts to representing a closed curve  (such as the shape boundary in our example) using an auxiliary function , called the level set function.  is represented as the zero level set of  by

and the level set method manipulates  implicitly, through the function . This function  is assumed to take positive values inside the region delimited by the curve  and negative values outside.
^ Osher, S.; Sethian, J. A. (1988), ""Fronts propagating with curvature-dependent speed: Algorithms based on Hamilton–Jacobi formulations"" (PDF), J. Comput. Phys. 79: 12–49., Bibcode:1988JCoPh..79...12O, doi:10.1016/0021-9991(88)90002-2 
^ 
^"
Levenberg–Marquardt algorithm,"In mathematics and computing, the Levenberg–Marquardt algorithm (LMA), also known as the damped least-squares (DLS) method, is used to solve non-linear least squares problems. These minimization problems arise especially in least squares curve fitting.
The LMA is used in many software applications for solving generic curve-fitting problems. However, as for many fitting algorithms, the LMA finds only a local minimum, which is not necessarily the global minimum. The LMA interpolates between the Gauss–Newton algorithm (GNA) and the method of gradient descent. The LMA is more robust than the GNA, which means that in many cases it finds a solution even if it starts very far off the final minimum. For well-behaved functions and reasonable starting parameters, the LMA tends to be a bit slower than the GNA. LMA can also be viewed as Gauss–Newton using a trust region approach.
The algorithm was first published in 1944 by Kenneth Levenberg, while working at the Frankford Army Arsenal. It was rediscovered in 1963 by Donald Marquardt who worked as a statistician at DuPont and independently by Girard, Wynn and Morrison."
Lexicographic breadth-first search,"In computer science, lexicographic breadth-first search or Lex-BFS is a linear time algorithm for ordering the vertices of a graph. The algorithm is different from breadth first search, but it produces an ordering that is consistent with breadth-first search.
The lexicographic breadth-first search algorithm is based on the idea of partition refinement and was first developed by Donald J. Rose, Robert E. Tarjan, and George S. Lueker (1976). A more detailed survey of the topic is presented by Corneil (2004). It has been used as a subroutine in other graph algorithms including the recognition of chordal graphs, and optimal coloring of distance-hereditary graphs."
Library sort,"Library sort, or gapped insertion sort is a sorting algorithm that uses an insertion sort, but with gaps in the array to accelerate subsequent insertions. The name comes from an analogy:

Suppose a librarian were to store his books alphabetically on a long shelf, starting with the A's at the left end, and continuing to the right along the shelf with no spaces between the books until the end of the Z's. If the librarian acquired a new book that belongs to the B section, once he finds the correct space in the B section, he will have to move every book over, from the middle of the B's all the way down to the Z's in order to make room for the new book. This is an insertion sort. However, if he were to leave a space after every letter, as long as there was still space after B, he would only have to move a few books to make room for the new one. This is the basic principle of the Library Sort.

The algorithm was proposed by Michael A. Bender, Martín Farach-Colton, and Miguel Mosteiro in 2004 and was published in 2006.
Like the insertion sort it is based on, library sort is a stable comparison sort and can be run as an online algorithm; however, it was shown to have a high probability of running in O(n log n) time (comparable to quicksort), rather than an insertion sort's O(n2). The mechanism used for this improvement is very similar to that of a skip list. There is no full implementation given in the paper, nor the exact algorithms of important parts, such as insertion and rebalancing. Further information would be needed to discuss how the efficiency of library sort compares to that of other sorting methods in reality.
Compared to basic insertion sort, the drawback of library sort is that it requires extra space for the gaps. The amount and distribution of that space would be implementation dependent. In the paper the size of the needed array is (1 + ε)n, but with no further recommendations on how to choose ε.
One weakness of insertion sort is that it may require a high number of swap operations and be costly if memory write is expensive. Library sort may improve that somewhat in the insertion step, as fewer elements need to move to make room, but is also adding an extra cost in the rebalancing step. In addition, locality of reference will be poor compared to mergesort as each insertion from a random data set may access memory that is no longer in cache, especially with large data sets."
Linde–Buzo–Gray algorithm,"The Linde–Buzo–Gray algorithm (introduced by Yoseph Linde, Andrés Buzo and Robert M. Gray in 1980) is a vector quantization algorithm to derive a good codebook.
It is similar to the k-means method in data clustering.

"
Line drawing algorithm,"A line drawing algorithm is a graphical algorithm for approximating a line segment on discrete graphical media. On discrete media, such as pixel-based displays and printers, line drawing requires such an approximation (in nontrivial cases). Basic algorithms rasterize lines in one color. A better representation with multiple color gradations requires an advanced process, anti-aliasing.
On continuous media, by contrast, no algorithm is necessary to draw a line. For example, oscilloscopes use natural phenomena to draw lines and curves.
The Cartesian slope-intercept equation for a straight line is  With m representing the slope of the line and b as the y intercept. Given that the two endpoints of the line segment are specified at positions  and . we can determine values for the slope m and y intercept b with the following calculations,  so, ."
Line segment intersection,"In computational geometry, the line segment intersection problem supplies a list of line segments in the Euclidean plane and asks whether any two of them intersect, or cross.
Simple algorithms examine each pair of segments. However, if a large number of possibly intersecting segments are to be checked, this becomes increasingly inefficient since most pairs of segments are not close to one another in a typical input sequence. The most common, more efficient way to solve this problem for a high number of segments is to use a sweep line algorithm, where we imagine a line sliding across the line segments and we track which line segments it intersects at each point in time using a dynamic data structure based on binary search trees. The Shamos–Hoey algorithm applies this principle to solve the line segment intersection detection problem, as stated above, of determining whether or not a set of line segments has an intersection; the Bentley–Ottmann algorithm works by the same principle to list all intersections in logarithmic time per intersection."
Linear-time,"In computer science, the time complexity of an algorithm quantifies the amount of time taken by an algorithm to run as a function of the length of the string representing the input. The time complexity of an algorithm is commonly expressed using big O notation, which excludes coefficients and lower order terms. When expressed this way, the time complexity is said to be described asymptotically, i.e., as the input size goes to infinity. For example, if the time required by an algorithm on all inputs of size n is at most 5n3 + 3n for any n (bigger than some n0), the asymptotic time complexity is O(n3).
Time complexity is commonly estimated by counting the number of elementary operations performed by the algorithm, where an elementary operation takes a fixed amount of time to perform. Thus the amount of time taken and the number of elementary operations performed by the algorithm differ by at most a constant factor.
Since an algorithm's performance time may vary with different inputs of the same size, one commonly uses the worst-case time complexity of an algorithm, denoted as T(n), which is defined as the maximum amount of time taken on any input of size n. Less common, and usually specified explicitly, is the measure of average-case complexity. Time complexities are classified by the nature of the function T(n). For instance, an algorithm with T(n) = O(n) is called a linear time algorithm, and an algorithm with T(n) = O(Mn) and mn= O(T(n)) for some M ≥ m > 1 is said to be an exponential time algorithm."
Linear programming,"Linear programming (LP; also called linear optimization) is a method to achieve the best outcome (such as maximum profit or lowest cost) in a mathematical model whose requirements are represented by linear relationships. Linear programming is a special case of mathematical programming (mathematical optimization).
More formally, linear programming is a technique for the optimization of a linear objective function, subject to linear equality and linear inequality constraints. Its feasible region is a convex polytope, which is a set defined as the intersection of finitely many half spaces, each of which is defined by a linear inequality. Its objective function is a real-valued affine (linear) function defined on this polyhedron. A linear programming algorithm finds a point in the polyhedron where this function has the smallest (or largest) value if such a point exists.
Linear programs are problems that can be expressed in canonical form as

where x represents the vector of variables (to be determined), c and b are vectors of (known) coefficients, A is a (known) matrix of coefficients, and  is the matrix transpose. The expression to be maximized or minimized is called the objective function (cTx in this case). The inequalities Ax ≤ b and x ≥ 0 are the constraints which specify a convex polytope over which the objective function is to be optimized. In this context, two vectors are comparable when they have the same dimensions. If every entry in the first is less-than or equal-to the corresponding entry in the second then we can say the first vector is less-than or equal-to the second vector.
Linear programming can be applied to various fields of study. It is widely used in business and economics, and is also utilized for some engineering problems. Industries that use linear programming models include transportation, energy, telecommunications, and manufacturing. It has proved useful in modeling diverse types of problems in planning, routing, scheduling, assignment, and design."
Linear search,"In computer science, linear search or sequential search is a method for finding a particular value in a list that checks each element in sequence until the desired element is found or the list is exhausted. The list need not be ordered.
Linear search is the simplest search algorithm; it is a special case of brute-force search. Its worst case cost is proportional to the number of elements in the list. Its expected cost is also proportional to the number of elements if all elements are searched equally. If the list has more than a few elements and is searched often, then more complicated search methods such as binary search or hashing may be appropriate. Those methods have faster search times but require additional resources to attain that speed."
Linear time,"In computer science, the time complexity of an algorithm quantifies the amount of time taken by an algorithm to run as a function of the length of the string representing the input. The time complexity of an algorithm is commonly expressed using big O notation, which excludes coefficients and lower order terms. When expressed this way, the time complexity is said to be described asymptotically, i.e., as the input size goes to infinity. For example, if the time required by an algorithm on all inputs of size n is at most 5n3 + 3n for any n (bigger than some n0), the asymptotic time complexity is O(n3).
Time complexity is commonly estimated by counting the number of elementary operations performed by the algorithm, where an elementary operation takes a fixed amount of time to perform. Thus the amount of time taken and the number of elementary operations performed by the algorithm differ by at most a constant factor.
Since an algorithm's performance time may vary with different inputs of the same size, one commonly uses the worst-case time complexity of an algorithm, denoted as T(n), which is defined as the maximum amount of time taken on any input of size n. Less common, and usually specified explicitly, is the measure of average-case complexity. Time complexities are classified by the nature of the function T(n). For instance, an algorithm with T(n) = O(n) is called a linear time algorithm, and an algorithm with T(n) = O(Mn) and mn= O(T(n)) for some M ≥ m > 1 is said to be an exponential time algorithm."
List of algorithm general topics,"This is a list of algorithm general topics.
Analysis of algorithms
Ant colony algorithm
Approximation algorithm
Best and worst cases
Big O notation
Combinatorial search
Competitive analysis
Computability theory
Computational complexity theory
Embarrassingly parallel problem
Emergent algorithm
Evolutionary algorithm
Fast Fourier transform
Genetic algorithm
Graph exploration algorithm
Heuristic
Hill climbing
Implementation
Las Vegas algorithm
Lock-free and wait-free algorithms
Monte Carlo algorithm
Numerical analysis
Online algorithm
Polynomial time approximation scheme
Problem size
Pseudorandom number generator
Quantum algorithm
Random-restart hill climbing
Randomized algorithm
Running time
Sorting algorithm
Search algorithm
Stable algorithm (disambiguation)
Super-recursive algorithm
Tree search algorithm"
List of algorithms,The following is a list of algorithms along with one-line descriptions for each.
List of terms relating to algorithms and data structures,"The NIST Dictionary of Algorithms and Data Structures is a reference work maintained by the U.S. National Institute of Standards and Technology. It defines a large number of terms relating to algorithms and data structures. For algorithms and data structures not necessarily mentioned here, see list of algorithms and list of data structures.
This list of terms was originally derived from the index of that document, and is in the public domain, as it was compiled by a Federal Government employee as part of a Federal Government work. Some of the terms defined are:

"
List scheduling,"The basic idea of list scheduling is to make an ordered list of processes by assigning them some priorities, and then repeatedly execute the following two steps until a valid schedule is obtained :
Select from the list, the process with the highest priority for scheduling.
Select a resource to accommodate this process.
If no resource can be found, we select the next process in the list.
The priorities are determined statically before scheduling process begins. The first step chooses the process with the highest priority, the second step selects the best possible resource. Some known list scheduling strategies are :
Highest level first algorithm or HLF
Longest path algorithm or LP
Longest processing time
Critical path method
Heterogeneous Earliest Finish Time or HEFT. For the case heterogeneous workers."
Lloyd's algorithm,"In computer science and electrical engineering, Lloyd's algorithm, also known as Voronoi iteration or relaxation, is an algorithm named after Stuart P. Lloyd for finding evenly spaced sets of points in subsets of Euclidean spaces, and partitions of these subsets into well-shaped and uniformly sized convex cells. Like the closely related k-means clustering algorithm, it repeatedly finds the centroid of each set in the partition, and then re-partitions the input according to which of these centroids is closest. However, Lloyd's algorithm differs from k-means clustering in that its input is a continuous geometric region rather than a discrete set of points. Thus, when re-partitioning the input, Lloyd's algorithm uses Voronoi diagrams rather than simply determining the nearest center to each of a finite set of points as the k-means algorithm does.
Although the algorithm may be applied most directly to the Euclidean plane, similar algorithms may also be applied to higher-dimensional spaces or to spaces with other non-Euclidean metrics. Lloyd's algorithm can be used to construct close approximations to centroidal Voronoi tessellations of the input, which can be used for quantization, dithering, and stippling. Other applications of Lloyd's algorithm include smoothing of triangle meshes in the finite element method."
Local search (optimization),"In computer science, local search is a metaheuristic method for solving computationally hard optimization problems. Local search can be used on problems that can be formulated as finding a solution maximizing a criterion among a number of candidate solutions. Local search algorithms move from solution to solution in the space of candidate solutions (the search space) by applying local changes, until a solution deemed optimal is found or a time bound is elapsed.
Local search algorithms are widely applied to numerous hard computational problems, including problems from computer science (particularly artificial intelligence), mathematics, operations research, engineering, and bioinformatics. Examples of local search algorithms are WalkSAT and the 2-opt algorithm for the Traveling Salesman Problem."
LogitBoost,"In machine learning and computational learning theory, LogitBoost is a boosting algorithm formulated by Jerome Friedman, Trevor Hastie, and Robert Tibshirani. The original paper casts the AdaBoost algorithm into a statistical framework. Specifically, if one considers AdaBoost as a generalized additive model and then applies the cost functional of logistic regression, one can derive the LogitBoost algorithm.

"
