Web Page Recommender,"This algorithm provides page recommendations for a domain. It is primarily geared for use with the Algorithmia recommendation system, which provides more specificity, but can be used independently of this as well.It takes as input a url and a required string. Only urls whose source contains the required string will be considered as recommendations. Note that the page source itself is inspected, not just the user-readable text. Examples include long UUIDs embedded in the page's java script, or simply the empty string """" to consider every page. Get Recommendations maintains a permanent algorithm collection (see the documentation). When a url is sent to it, it checks to see if any url from the same domain has ever been sent. If not, the domain is explored, for 200 urls or 2 minutes, whichever comes first, using /web/BreadthFirstSiteMap and filtering for urls containing the required string. These urls are processed into recommendations as described below.It also takes an optional third integer parameter, which dictates how many months in the past (relative to a given page) will be considered for recommendation. For example, if the parameter is 24, no page that is more than 24 months older than a given page will be recommended. Note however that recommendations are always being updated as new pages are added, and for any given page, anything published more recently than it is eligible as a recommendation assuming some nonzero similarity. If this parameter is not supplied or is equal to -1, all pages will be considered.For each explored domain, the algorithm maintains a word count summary for each url and for the domain as a whole. For every new url in an existing domain, it scrapes the url for content using /web/AnalyzeURL, processes this into word statistics, and generates keywords for each url using  /nlp/KeywordsForDocumentSet, and generates recommendations from these keywords using /nlp/KeywordSetSimilarity. All recommendations are stored in a table, and any time the algorithm is queried with a url that is in this table, it returns the corresponding recommendations. Thus, the first call to a domain takes a few minutes and a call with a novel url takes up to a few seconds, but any subsequent call with a url returns very quickly."
Html 2 Text,Takes in a url and extracts the content from the page.Makes an attempt to remove non-content text like navigation and footer text.
PorterStemmer,Lucene PorterStemmer 3.6.2
AutoTag,This class takes in text content as a set of documents and produces candidate tags using LDA. Pipe your input as a json array of strings.
Sentiment Analysis,"Identify and extract sentiment in given string. Sentiment analysis (also known as opinion mining) refers to the use of natural language processing, text analysis and computational linguistics to identify and extract subjective information in source materials. This algorithm takes an input string and assigns a sentiment rating in the range [0-4] (very negative, negative, neutral, positive, and very positive).For more information, please refer to http://nlp.stanford.edu/software/corenlp.shtml or Manning, Christopher D., Surdeanu, Mihai, Bauer, John, Finkel, Jenny, Bethard, Steven J., and McClosky, David. 2014. The Stanford CoreNLP Natural Language Processing Toolkit. In Proceedings of 52nd Annual Meeting of the Association for Computational Linguistics: System Demonstrations, pp. 55-60. "
Auto-Tag Github,"Provide this algorithm a github repository and it will generate topic tags of its README based on LDA. Input is in the format [user,repo], and the repository queried is of form ""http://github.com/"" + user + ""/"" + repo."
LDA,"In natural language processing, Latent Dirichlet Allocation (LDA) is a generative model that allows sets of observations to be explained by unobserved groups that explain why some parts of the data are similar. For example, if observations are words collected into documents, it posits that each document is a mixture of a small number of topics and that each word's creation is attributable to one of the document's topics. LDA is an example of a topic model and was first presented as a graphical model for topic discovery by David Blei, Andrew Ng, and Michael Jordan in 2003. InputA list of strings representing observationsThe number of topics to generate"
Url 2 Text,Takes in a url and extracts the content from the page.Makes an attempt to remove non-content text like navigation and footer text.
Analyze URL,"Given a url and a target string, returns several pieces of information on the url, including ""text"" - the text of the page (similar to /util/Url2Text) , ""title"" - the page title, ""summary"" - a summary of the page text (using either the meta description of the page, or, if this is not available, the summary of the page text via /nlp/Summarizer), ""thumbnail"" - the url of the main image on the page, if it can be located, and a boolean denoting if the page source contains the target string. Note that all information is provided on a best effort basis, if something can be found it will not be included in the output.Input consists of:url: The URL of the page to analyzemarker: An optional search term to look for in the page"
LDA,"In natural language processing, Latent Dirichlet Allocation (LDA) is a generative model that allows sets of observations to be explained by unobserved groups that explain why some parts of the data are similar. For example, if observations are words collected into documents, it posits that each document is a mixture of a small number of topics and that each word's creation is attributable to one of the document's topics. LDA is an example of a topic model and was first presented as a graphical model for topic discovery by David Blei, Andrew Ng, and Michael Jordan in 2003. InputA list of strings representing observationsThe number of topics to generate"
Scrape RSS,"Takes the url of an RSS feed and scrapes the RSS feed, extracting title, link url, and comments url."
Recommend GitHub From Tags,"Based on topic tags, this algorithm will recommend similar Github repositories. The input consists of tags with corresponding desired scores."
Maze Generator,Generate a maze with long winding pathways using Recursive Backtracking Search.Takes in as input width and height of the requested maze.
Scrape HN,"Scrapes the HackerNews RSS feed and extracts title, link url, and comments url."
PageRank,"This is a simple implementation of the PageRank algorithm.  It accepts an input in the form of an int[][] or a String which can define the d value and the number of loops. The default d value is 0.85, and the default number of loops is 20.

Input Descriptionpage 0 links to pages 1,2,3Page 1 links to page 0Page 2 links to page 0Page 3 links to pages 0,4,5,6,7page 4 has no linkspage 5 has no linkspage 6 has no linkspage 7 has no linksSample Input[[1,2,3],[0],[0],[0,4,5,6,7],[],[],[],[]]Sample Output[0.9142543787391981,0.4089334112608257,0.4089334112608257,0.4089334112608257,0.21947767079447258,0.21947767079447258,0.21947767079447258,0.21947767079447258]








"
levenshtein,"The Levenshtein Distance algorithm measures the distance between two strings, returning the minimum number of changes required to change one string to another."
Weka Classification,"This is the main algorithm that all of the Weka classification algorithms call. It is preferred that you do not call this algorithm directly, but by one of the classifiers on the platform. The Weka algorithms that are on the platform take in flat Json as input. It is assumed that any data that is going to be used with these algorithms will be large in size, so all interaction is done through Data collections. You can look at the DigitRecognition algorithm we made for a quick demo of how to use Weka algorithms. That algorithm takes in either a matrix or an array of doubles that represent a black and white picture. The picture is a hand-drawn digit, and we feed it to a pretrained model on the MNIST dataset that will classify which of the 10 digits this particular one is. "
Sentence Detection,"Takes a block of text and splits into sentences, returning each sentence as an entry in a String array.For more information visit http://opennlp.apache.org."
Digit Recognizer,"Applies a random forest model trained on the MNIST handwritten digit dataset to a 28 by 28 grayscale pixel grid, which is input as a double array of length 784. Supports the Mahout portion of the handwritten digit classification demo"
Random Forest Apply,"OverviewThis routine applies a previously learned Mahout Random Forest Classifier to a set of test data. It takes as input a JSON array of four items, the first three are Data API URLs, of the (unlabeled) test data, the model file, and the (labelled) data used to train the model file, respectively, followed by a descriptor that details the type of each field in the dataset. It outputs the predicted labels of each instance in the test set. Note that test and training files are assumed to be CSVs.Data Format and DescriptorWe assume that the first entry of any instance is the label, though Mahout does support other placement. The descriptor must be of form ""L X X X ..."", where each X designates the type of its respective field, either I (ignored), N (numerical), or C (categorical). L designates the label label. Think of the descriptor as a header for the data. As an example, a dataset with four attributes (beyond the label) might have the first two as categorical, the third numerical, and the last ignored, and its header would be ""L C C N I"".With the test data we don’t have a label and as a matter of convention Mahout expects us to pass a ""-"". Our code currently handles this as long as your data has the label as the first field, and this field is missing in test data."
Site Map,Returns the graph resulting in crawling a URL for all links. 
Product Hunt Recommender,"Takes a post id from Product Hunt and returns up to five recommended posts. This algorithm is based on FP-Growth, found here:https://algorithmia.com/algorithms/paranoia/FpGrowth"
ExtractDependencies,"Input: Text.Output: For each sentence, a List of the dependencies we think might be useful."
Echo,This algorithm returns whatever you give it. Seems pretty clear.
Keyword Set Similarity ,"Determines similarity between sets of weighted keywords. Each keyword set is represented as a Map<String,Double>, where the String is the keyword and the Double is it's weight. The similarity of two sets is the sum of the products of the weights of their shared keywords, for instance, if set A has keywords ""dog"", ""cat"", and ""mouse"" with weights 1,2, and 2, respectively and set B has keywords ""dog"", ""cat"", and ""moose"" with weights 1.5,3, and 4, their similarity by this metric is 1*1.5 + 2*3 = 7.5. This can be thought of as the inner product of word vectors.The most convenient input format for a set of keyword sets is Map<String,Map<String,Double>>, where the first String key is an identifier for the keyword set, and it's value, a Map<String,Double>, is the set of keywords with their respective weights as values. The algorithm also requires an int that determines the maximum number of similar sets to return for each keyword set. The output for this input form is a Map from Strings to Set<String>'s, where the Set<String> value is the set of most similar keyword sets (denoted by a String identifier)."
Othello,An AI othello player.Input is a board represented as a 2D array of integers. 0 = empty1 = black2 = white
Keywords For Document Set,"Given a set of documents (represented as a List<String>) and a maximum number of keywords to return per document, returns a list, each entry of which contains the most relevant (as measured by weight) keywords for the respective document. In a given document, a keyword receives a higher weight for the number of times it appears in the document and a lower weight for the number of other documents it appears in. This is a simple implementation of tf-idf scoring."
Product Hunt Vote Rings,This algorithm takes two parameters (filter and limit) and returns the latest Product Hunt posts having a collusion ratio higher than 'filter'. The 'limit' parameter is used to specify maximum number of records returned. This depends on 'SimpleVoteRingDetection' algorithm to calculate the collusion ratio.
FpGrowth,"Java implementation of the Frequent Pattern Growth (FP-Growth) algorithm, which is a scalable method for finding frequent patterns within large datasets. For example, it could be used to find Association Rules and develop collaborative-filtering  systems, such as ""Other people also bought""... The algorithm takes three arguments:Dataset: path to a local (data://...) dataset, where each line represents a single transaction and each item is separated by whitespace. (See Example file).Support: represents the minimum frequency for a pattern to be recognized. In most cases you'll want to increase this number to reduce the size of the output.MinItems: represents the minimum number of items (per association rule). Having the value of this argument as 1 will return each unique item in the dataset and the number of times they appeared. Most applications would require a number higher than 1.This algorithm was featured in the Algorithmia Blog Post: ""Mining Product Hunt, Part 2: Building a Recommendation Engine""."
GraphGen,Given an array of integers creates grid graph.
Tokenizer,"Tokenizes input text, returning each token in order as a string in a string array. By default uses English tokenization model en-token.bin. To use an alternate tokenization model, call with arguments [<input text>, ""data://ApacheOpenNLP/models/<tokenization model>""].For more information visit http://opennlp.apache.org."
DigitRecognition,The Digit Recognition algorithm that uses a Random Forest model trained on 50000 samples obtained from the MNIST digits dataset.
Language Identification,This is a language identifier based on Apache Tika. It can identify 18 different languages. It takes a string as input and returns its best guess as to what language the string is written in. Currently supported languages areda—Danishde—Germanet—Estonianel—Greeken—Englishes—Spanishfi—Finnishfr—Frenchhu—Hungarianis—Icelandicit—Italiannl—Dutchno—Norwegianpl—Polishpt—Portugueseru—Russiansv—Swedishth—Thai
Get Building Permit Data,"Aggregates Socrata Building Permit data based on city. Valid cities are: Boston, Santa Rosa, New York City, Edmonton, Los Angeles, Fort Worth"
Autocorrelate,Computes the  autocorrelation  plot of a time series.
Linear Detrend,"Takes a time series (either a double[][] for unevenly spaced data, with time in the first column, or a double[] for evenly spaced data), fits a linear trend to the data, and returns the data with the linear trend subtracted out."
Retrieve Tweets With Keyword,Retrieve tweets that include keyword anywhere int their text. Limited to 500 tweets per call. 
Top Periods,Returns the top periods present in the input double[].
Sentiment Analysis,"Sentiment analysis (also known as opinion mining) refers to the use of natural language processing, text analysis and computational linguistics to identify and extract subjective information in source materials. This algorithm takes an input string and assigns a sentiment rating in the range [0-4].For more information, please refer to http://nlp.stanford.edu/software/corenlp.shtml or Manning, Christopher D., Surdeanu, Mihai, Bauer, John, Finkel, Jenny, Bethard, Steven J., and McClosky, David. 2014. The Stanford CoreNLP Natural Language Processing Toolkit. In Proceedings of 52nd Annual Meeting of the Association for Computational Linguistics: System Demonstrations, pp. 55-60. "
Forecast,"Gives a forecast the next n steps of a given time series based on extrapolation of linear and seasonal trends. It takes as inputA time series as a double[].A number of time steps into the future to forecast.A maximum number of seasonal periods to consider.Alternatively it takes just a time series, and defaults to a forecast range equal to the length of the original series and  the single strongest seasonal trend.It returns the forecasted series as a double[]. This algorithm works by fitting a linear trend to the given data, extrapolating it into the future series interval, and then adjusting it based on the expected contributions of each detected seasonal component. Seasonality is detected using https://algorithmia.com/algorithms/TimeSeries/Autocorrelate.Note that this algorithm only deals with linear and seasonal trends. If other artifacts, such as non-seasonal spikes or super/sub-linear trends, are present in the data, results will suffer, and as a general rule the further you go in the future, the less accuracy you should expect."
Factor,"Takes an integer, and decomposes it into its prime factors."
Object Detection With Models,"Core algorithm for taking in an image and a pretrained model and detecting objects. Call this algorithm from another algorithm, by giving a pretrained model file link. For usage examples, see:FaceDetectionSmileDetectionEyeDetectionBodyDetection"
Face Recognition,"Performs face recognition using OpenCV.  This is the internal workings of the corresponding algorithms Train Face Recognizer and Recognize Faces.  Users will probably prefer to use those algorithms, and should refer to their documentation for guidance.  "
Weka Cluster,k-means clustering using the Weka machine learning library.
Digit Recognition,"This algorithm classifies an image of a digit, given as an array."
BIPM,
Recognize Faces,"Uses a trained face recognizer to identify faces. This is a wrapper for the FaceRecognition algorithm.  The FaceRecognition algorithm additionally requires a user to specify a ""classify"" mode, so this wrapper makes things slightly more convenient. Users must pass in a list of JSON objects, one for each image.  Each image JSON object must have a ""Path"" field specifying the image URL (e.g. the path to the image in an Algorithmia collection).  Optionally, it may have a ""ID"" field with an ID (or label) saying whose face is pictured.  This is useful mainly for academic purposes to evaluate the model; of course in many real-world situations the point of having a face recognizer is to recognize people whose identity is not explicitly labeled already.  (Note: if an image has multiple faces, each face will be classified.  As in the accompanying Train/Update Face Recognizer algorithms, any ID that is provided will be the ""ground truth"" ID for each face in the image.)Users must also specify the full path to a face recognizer in an Algorithmia data collection (including the name of the face recognizer XML file).  There must also be a map of human IDs to internal numeric labels in a file with the same name plus an ""_idList.txt"" tag and extension instead of a "".xml"" extension. Both files must have the same name and must be in the same directory (the default name is facerec.xml and facerec_idList.txt).  These would both have been created, say, by a run of the companion Train Face Recognizer algorithm.  The output will be in JSON format, where each image path will have a list of predictions--one prediction for each face in the image--in JSON format.  Each prediction will contain: the predicted ID, the actual ID (if known), and the uncertainty, which is actually a distance measure to the nearest match.  Note: the predicted ID will be ""Unknown"" if the uncertainty is too high (at this time the threshold is 100).  (For clarity, it is obviously highly recommended that ""Unknown"" not be used as a valid image ID.)"
SentenceTagger,"Input: TextOutput: List of JsonObjects with Sentence as string[] words, with int[] verbs and int[] nouns containing positions of the verbs and nouns in the sentence."
Face Detection,"Uses a pretrained model to detect faces in a given image. Send your input as a url to a picture that is either hosted on our data API or is a direct link, and the output is the same image, with rectangles around the detected faces, written to your collection. A text file that contains all the coordinates of the rectangles is also output to the same collection for convenience. The text file contains 4 integers: the x and y coordinates of the top left of the rectangle, the width of the rectangle and the height of the rectangle.If you like, you can give an arbitrary URL as the first input, the second input will still have to be a data collection because we will be writing the output of the algorithm: [""http://fluorineplus.com/wp-content/2012/07/Natural-Ways-To-Take-Care-300x293.jpg"", ""data://.algo/temp/result.jpg""]"
Tech Events Finder,"Returns a list of future tech events from from Meetup and Eventbrite. Takes three inputs: country, state, and city."
Prepare Input Array,"This algorithm separates input string by spaces and makes them into an array. It is a convenience algorithm that takes in a String of values that need to be passed in to an Algorithm via Json. It is most useful for ""Algorithmia.call"" calls that take in multiple values. By sticking all values that need to be added into a JsonArray in a String delimited by a space ("" "") and passing it into this algorithm, the user gets back the prepared JsonArray."
Extract Text,"Extracts text from a given file. Supported formats include Office documents (Word, Powerpoint, etc), HTML, XML, PDF, RTF, etc. For more information on supported formats, please take a look at Apache Tika's documentation page.This algorithm handles any URL, be it from the Data API or the URL to a file on the internet."
Receipt Recognition,This algorithm reads a computer printed or handwritten receipt (containing only the total or tip portions) and returns the value written.Please upload the image of the receipt to a Data collection and give the direct link to this algorithm.
Breadth First Site Map,"A more efficient site mapper that explores in a breadth-first fashion. Given a url and a max number of pages to return, it explores in a breadth-first fashion until it detects that is has passed the maximum allowed number of pages, or until it has run for two minutes, whichever comes first. Returns an adjacency map of urls. Optionally, you can provide a list of required terms as a third argument. If you do this, the algorithm will return a hashmap with two keys, ""map"", whose value is the site map as described above, and ""marked"", whose value is a list of URLs whose html (including human-readable text) contains at least one of the strings provided in the third argument. This is most useful for finding specific html tags, though be careful of very short or common words that might be present either in html or in human readable text."
Count Social Shares,"Given a URL, returns the number of times that URL has been shared on various social media sites, currently facebook, twitter, pinterest, and linkedin. Facebook has more detailed information, including shares, comments, and likes, all others are just number of shares.  Please use the full http://.. syntax to ensure the best possible results."
Lat Long Distance,"Returns the geographical distance between two points defined by latitude and longitude. The first two arguments are the coordinates of one points, the second two the coordinates of the second point. The final argument is string, either ""km"" or ""mile"", depending upon if units of kilometers or miles are desired. This is calculated using the haversine formula and may not be accurate for points that are very close."
SentimentAnalysis,Sentiment analysis based on Apache Open NLP and SentiWordNet.Result:     positive: > 0     neutral: 0    negative: < 0
Generate Random Love Letter,Generates a random letter from trigrams trained from http://archive.lovingyou.com/content/inspiration/loveletters.php. Inputs are your valentine's and your names!
Parallel For Each,"An algorithm to run another algorithm on a list of inputs, run in parallel.This algorithm takesThe name of an algorithm (eg- ""/util/Echo"")A list of inputs which will map each input to the output of the given algorithmNote: This algorithm may not correctly run all iterations if the input algorithm calls other algorithms."
Random Text From Trigram,"This algorithm generates random text from a trained trigram model. The inputs are the Data URL that contains the trained file, and a beginning and an end token that will specify legitimate sentence beginnings and ends. You can learn more about Data collections on the Trigram generator algorithm page."
Image Binarization,"This algorithm binarizes the input image, useful for cleaning background noise in a text image to be input to OCR. This algorithm uses the implementation described in http://liris.cnrs.fr/christian.wolf/software/binarize/. The parameters are identical to those explained in the website. Unless the user finds a compelling reason, in general, the newest algorithm, ""w"", is the best performing algorithm and it is the default. You may wish to experiment with different parameters to find out the one that best fits your image.         -n Niblack (1986)       needs white text on black background
         -s Sauvola et al. (1997) needs black text onwhite background
         -w Wolf et al. (2001)   needs black text on white background

Default version: w (Wolf et al. 2001)
Default value for ""k"": 0.5

example:
      [""data://opencv/SampleImages/sampleOCR.jpg"", 
       """", ""data://opencv/SampleImages/sampleOCRCleaned.jpg""]"
